{
  "$schema": "https://json-schema.org/draft/2020-12/schema",
  "$id": "https://github.com/Yanagisawa2002/unity-shader-hitch-pipeline/blob/main/Schemas/warmup-plan.schema.json",
  "title": "Shader Hitch Pipeline warmup plan",
  "type": "object",
  "required": [
    "schemaVersion",
    "profileId",
    "adapterId",
    "adapterVersion",
    "runtimePlatform",
    "graphicsDeviceType",
    "phases",
    "planSha256"
  ],
  "properties": {
    "schemaVersion": {
      "const": 3
    },
    "packageVersion": {
      "type": "string"
    },
    "profileId": {
      "type": "string",
      "minLength": 1
    },
    "generatedUtc": {
      "type": "string"
    },
    "adapterId": {
      "type": "string",
      "minLength": 1
    },
    "adapterVersion": {
      "type": "string",
      "minLength": 1
    },
    "runtimePlatform": {
      "type": "string",
      "minLength": 1
    },
    "graphicsDeviceType": {
      "type": "string",
      "minLength": 1
    },
    "qualityLevelName": {
      "type": "string"
    },
    "sourceSessionCount": {
      "type": "integer",
      "minimum": 1
    },
    "sourceSessionHashes": {
      "type": "array",
      "items": {
        "type": "string",
        "pattern": "^[0-9a-fA-F]{64}$"
      }
    },
    "phases": {
      "type": "array",
      "minItems": 1,
      "items": {
        "$ref": "#/$defs/phase"
      }
    },
    "planSha256": {
      "type": "string",
      "pattern": "^[0-9a-fA-F]{64}$"
    },
    "compatibility": {
      "anyOf": [
        {
          "type": "null"
        },
        {
          "type": "object",
          "required": [
            "version",
            "collectionEnvironment"
          ],
          "properties": {
            "version": {
              "const": 1
            },
            "collectionEnvironment": {
              "type": "object",
              "required": [
                "graphicsDeviceVendorId",
                "unityVersion",
                "qualityLevelName",
                "graphicsDeviceType",
                "graphicsDeviceName",
                "graphicsDeviceId",
                "graphicsDeviceVendor",
                "engineVersion",
                "engineName",
                "identity",
                "runtimePlatform"
              ],
              "properties": {
                "engineName": {
                  "type": "string"
                },
                "engineVersion": {
                  "type": "string"
                },
                "unityVersion": {
                  "type": "string"
                },
                "runtimePlatform": {
                  "type": "string"
                },
                "graphicsDeviceType": {
                  "type": "string"
                },
                "graphicsDeviceName": {
                  "type": "string"
                },
                "graphicsDeviceVendor": {
                  "type": "string"
                },
                "graphicsDeviceVersion": {
                  "type": "string"
                },
                "graphicsMemorySizeMb": {
                  "type": "integer",
                  "minimum": 0
                },
                "qualityLevelName": {
                  "type": "string"
                },
                "operatingSystem": {
                  "type": "string"
                },
                "graphicsDeviceId": {
                  "type": "integer",
                  "minimum": 0
                },
                "graphicsDeviceVendorId": {
                  "type": "integer",
                  "minimum": 0
                },
                "processorCount": {
                  "type": "integer",
                  "minimum": 0
                },
                "processorType": {
                  "type": "string"
                },
                "renderingThreadingMode": {
                  "type": "string"
                },
                "costExecutionContext": {
                  "type": "string"
                },
                "buildGuid": {
                  "type": "string"
                },
                "productName": {
                  "type": "string"
                },
                "applicationVersion": {
                  "type": "string"
                },
                "identity": {
                  "type": "object",
                  "required": [
                    "version",
                    "source",
                    "buildInputSha256",
                    "shaderSha256",
                    "contentSha256",
                    "contentId",
                    "contentRevision"
                  ],
                  "properties": {
                    "version": {
                      "const": 1
                    },
                    "source": {
                      "const": "unity-build-inputs-v1"
                    },
                    "buildInputSha256": {
                      "type": "string",
                      "pattern": "^[0-9a-fA-F]{64}$",
                      "not": {
                        "const": "0000000000000000000000000000000000000000000000000000000000000000"
                      }
                    },
                    "shaderSha256": {
                      "type": "string",
                      "pattern": "^[0-9a-fA-F]{64}$",
                      "not": {
                        "const": "0000000000000000000000000000000000000000000000000000000000000000"
                      }
                    },
                    "contentSha256": {
                      "type": "string",
                      "pattern": "^[0-9a-fA-F]{64}$",
                      "not": {
                        "const": "0000000000000000000000000000000000000000000000000000000000000000"
                      }
                    },
                    "contentId": {
                      "type": "string",
                      "minLength": 1
                    },
                    "contentRevision": {
                      "type": "string",
                      "minLength": 1
                    }
                  },
                  "additionalProperties": false
                },
                "driverIdentity": {
                  "type": [
                    "string",
                    "null"
                  ]
                },
                "driverIdentitySource": {
                  "type": [
                    "string",
                    "null"
                  ]
                },
                "driverVersion": {
                  "type": [
                    "string",
                    "null"
                  ]
                },
                "driverIdentityError": {
                  "type": [
                    "string",
                    "null"
                  ]
                },
                "driverRegistryIdentity": {
                  "type": [
                    "string",
                    "null"
                  ]
                },
                "driverModules": {
                  "type": "array",
                  "items": {
                    "type": "object",
                    "required": [
                      "file",
                      "sha256"
                    ],
                    "properties": {
                      "file": {
                        "type": "string"
                      },
                      "sha256": {
                        "type": "string",
                        "pattern": "^[0-9a-fA-F]{64}$"
                      },
                      "bytes": {
                        "type": "integer",
                        "minimum": 1
                      },
                      "lastWriteUtcTicks": {
                        "type": "integer",
                        "minimum": 1
                      }
                    }
                  }
                },
                "driverBytesAttestedUtc": {
                  "type": "string",
                  "description": "UTC of successful byte hashing; unchanged during process-local metadata-checked reuse."
                },
                "driverMetadataCheckedUtc": {
                  "type": "string",
                  "description": "UTC of latest device/registry/loaded-module/file-metadata check; not a fresh byte hash."
                },
                "driverByteAttestationReused": {
                  "type": "boolean"
                }
              }
            },
            "costEnvironment": {
              "anyOf": [
                {
                  "type": "null"
                },
                {
                  "type": "object",
                  "required": [
                    "graphicsDeviceVendorId",
                    "unityVersion",
                    "qualityLevelName",
                    "graphicsDeviceType",
                    "graphicsDeviceName",
                    "graphicsDeviceId",
                    "graphicsDeviceVendor",
                    "engineVersion",
                    "engineName",
                    "identity",
                    "runtimePlatform"
                  ],
                  "properties": {
                    "engineName": {
                      "type": "string"
                    },
                    "engineVersion": {
                      "type": "string"
                    },
                    "unityVersion": {
                      "type": "string"
                    },
                    "runtimePlatform": {
                      "type": "string"
                    },
                    "graphicsDeviceType": {
                      "type": "string"
                    },
                    "graphicsDeviceName": {
                      "type": "string"
                    },
                    "graphicsDeviceVendor": {
                      "type": "string"
                    },
                    "graphicsDeviceVersion": {
                      "type": "string"
                    },
                    "graphicsMemorySizeMb": {
                      "type": "integer",
                      "minimum": 0
                    },
                    "qualityLevelName": {
                      "type": "string"
                    },
                    "operatingSystem": {
                      "type": "string"
                    },
                    "graphicsDeviceId": {
                      "type": "integer",
                      "minimum": 0
                    },
                    "graphicsDeviceVendorId": {
                      "type": "integer",
                      "minimum": 0
                    },
                    "processorCount": {
                      "type": "integer",
                      "minimum": 0
                    },
                    "processorType": {
                      "type": "string"
                    },
                    "renderingThreadingMode": {
                      "type": "string"
                    },
                    "costExecutionContext": {
                      "type": "string"
                    },
                    "buildGuid": {
                      "type": "string"
                    },
                    "productName": {
                      "type": "string"
                    },
                    "applicationVersion": {
                      "type": "string"
                    },
                    "identity": {
                      "type": "object",
                      "required": [
                        "version",
                        "source",
                        "buildInputSha256",
                        "shaderSha256",
                        "contentSha256",
                        "contentId",
                        "contentRevision"
                      ],
                      "properties": {
                        "version": {
                          "const": 1
                        },
                        "source": {
                          "const": "unity-build-inputs-v1"
                        },
                        "buildInputSha256": {
                          "type": "string",
                          "pattern": "^[0-9a-fA-F]{64}$",
                          "not": {
                            "const": "0000000000000000000000000000000000000000000000000000000000000000"
                          }
                        },
                        "shaderSha256": {
                          "type": "string",
                          "pattern": "^[0-9a-fA-F]{64}$",
                          "not": {
                            "const": "0000000000000000000000000000000000000000000000000000000000000000"
                          }
                        },
                        "contentSha256": {
                          "type": "string",
                          "pattern": "^[0-9a-fA-F]{64}$",
                          "not": {
                            "const": "0000000000000000000000000000000000000000000000000000000000000000"
                          }
                        },
                        "contentId": {
                          "type": "string",
                          "minLength": 1
                        },
                        "contentRevision": {
                          "type": "string",
                          "minLength": 1
                        }
                      },
                      "additionalProperties": false
                    },
                    "driverIdentity": {
                      "type": [
                        "string",
                        "null"
                      ]
                    },
                    "driverIdentitySource": {
                      "type": [
                        "string",
                        "null"
                      ]
                    },
                    "driverVersion": {
                      "type": [
                        "string",
                        "null"
                      ]
                    },
                    "driverIdentityError": {
                      "type": [
                        "string",
                        "null"
                      ]
                    },
                    "driverRegistryIdentity": {
                      "type": [
                        "string",
                        "null"
                      ]
                    },
                    "driverModules": {
                      "type": "array",
                      "items": {
                        "type": "object",
                        "required": [
                          "file",
                          "sha256"
                        ],
                        "properties": {
                          "file": {
                            "type": "string"
                          },
                          "sha256": {
                            "type": "string",
                            "pattern": "^[0-9a-fA-F]{64}$"
                          },
                          "bytes": {
                            "type": "integer",
                            "minimum": 1
                          },
                          "lastWriteUtcTicks": {
                            "type": "integer",
                            "minimum": 1
                          }
                        }
                      }
                    },
                    "driverBytesAttestedUtc": {
                      "type": "string",
                      "description": "UTC of successful byte hashing; unchanged during process-local metadata-checked reuse."
                    },
                    "driverMetadataCheckedUtc": {
                      "type": "string",
                      "description": "UTC of latest device/registry/loaded-module/file-metadata check; not a fresh byte hash."
                    },
                    "driverByteAttestationReused": {
                      "type": "boolean"
                    }
                  }
                }
              ]
            },
            "costModelVersion": {
              "type": [
                "string",
                "null"
              ]
            }
          },
          "additionalProperties": false
        }
      ]
    }
  },
  "$defs": {
    "phase": {
      "type": "object",
      "required": [
        "phase",
        "collectionFile",
        "collectionSha256",
        "graphicsStateCount",
        "targetFrameMilliseconds",
        "estimatedMillisecondsPerState",
        "bootstrapBatchSize",
        "budgetSafetyMarginMilliseconds",
        "budgetCostSafetyMultiplier",
        "budgetCooldownFrames",
        "preinteractiveBootstrap"
      ],
      "properties": {
        "phase": {
          "type": "string",
          "minLength": 1
        },
        "collectionFile": {
          "type": "string",
          "minLength": 1
        },
        "collectionSha256": {
          "type": "string",
          "pattern": "^[0-9a-fA-F]{64}$"
        },
        "variantCount": {
          "type": "integer",
          "minimum": 0
        },
        "graphicsStateCount": {
          "type": "integer",
          "minimum": 1
        },
        "required": {
          "type": "boolean"
        },
        "prewarmAtStartup": {
          "type": "boolean"
        },
        "traceCacheMisses": {
          "type": "boolean"
        },
        "priority": {
          "type": "integer"
        },
        "initialBatchSize": {
          "type": "integer",
          "minimum": 1
        },
        "minimumBatchSize": {
          "type": "integer",
          "minimum": 1
        },
        "maximumBatchSize": {
          "type": "integer",
          "minimum": 1
        },
        "targetFrameMilliseconds": {
          "type": "number",
          "exclusiveMinimum": 0
        },
        "deadlineMilliseconds": {
          "type": "number",
          "minimum": 0
        },
        "estimatedMillisecondsPerState": {
          "type": "number",
          "exclusiveMinimum": 0
        },
        "expectedUseProbability": {
          "type": "number",
          "minimum": 0,
          "maximum": 1
        },
        "hotSetTier": {
          "type": "integer",
          "minimum": 0
        },
        "bootstrapBatchSize": {
          "type": "integer",
          "minimum": 1
        },
        "budgetSafetyMarginMilliseconds": {
          "type": "number",
          "minimum": 0
        },
        "budgetCostSafetyMultiplier": {
          "type": "number",
          "minimum": 1
        },
        "budgetCooldownFrames": {
          "type": "integer",
          "minimum": 0
        },
        "preinteractiveBootstrap": {
          "type": "boolean"
        }
      }
    }
  }
}
