{
    "schemaVersion": 3,
    "packageVersion": "0.3.0",
    "profileId": "hotset-fixture",
    "generatedUtc": "",
    "runtimePlatform": "WindowsPlayer",
    "graphicsDeviceType": "Direct3D12",
    "qualityLevelName": "Ultra",
    "adapterId": "unity.graphics-state-collection",
    "adapterVersion": "1",
    "sourceSessionCount": 0,
    "sourceSessionHashes": [],
    "phases": [
        {
            "phase": "u0",
            "collectionFile": "unit-0.graphicsstate",
            "collectionSha256": "9f1f5b163eeb7b41ad14bb3353c7f6856658cb8092db6f483c6a1d6df1c7a639",
            "variantCount": 0,
            "graphicsStateCount": 5,
            "required": true,
            "prewarmAtStartup": true,
            "traceCacheMisses": true,
            "priority": 0,
            "initialBatchSize": 8,
            "minimumBatchSize": 1,
            "maximumBatchSize": 64,
            "targetFrameMilliseconds": 16.67,
            "deadlineMilliseconds": 0.0,
            "estimatedMillisecondsPerState": 0.24018,
            "expectedUseProbability": 1.0,
            "hotSetTier": 1,
            "bootstrapBatchSize": 1,
            "budgetSafetyMarginMilliseconds": 2.0,
            "budgetCostSafetyMultiplier": 1.5,
            "budgetCooldownFrames": 8,
            "preinteractiveBootstrap": true
        },
        {
            "phase": "u1",
            "collectionFile": "unit-1.graphicsstate",
            "collectionSha256": "f5b91eccf0d09e912324b838ac26e067951688bf0972c55b683b0b92e717e483",
            "variantCount": 0,
            "graphicsStateCount": 5,
            "required": false,
            "prewarmAtStartup": true,
            "traceCacheMisses": true,
            "priority": 0,
            "initialBatchSize": 8,
            "minimumBatchSize": 1,
            "maximumBatchSize": 64,
            "targetFrameMilliseconds": 16.67,
            "deadlineMilliseconds": 0.0,
            "estimatedMillisecondsPerState": 0.10332,
            "expectedUseProbability": 1.0,
            "hotSetTier": 1,
            "bootstrapBatchSize": 1,
            "budgetSafetyMarginMilliseconds": 2.0,
            "budgetCostSafetyMultiplier": 1.5,
            "budgetCooldownFrames": 8,
            "preinteractiveBootstrap": true
        },
        {
            "phase": "u2",
            "collectionFile": "unit-2.graphicsstate",
            "collectionSha256": "36e08f70f5b947efed9679eb179247d8e8fa30afdadf07202d081d902c2a46db",
            "variantCount": 0,
            "graphicsStateCount": 5,
            "required": false,
            "prewarmAtStartup": true,
            "traceCacheMisses": true,
            "priority": 0,
            "initialBatchSize": 8,
            "minimumBatchSize": 1,
            "maximumBatchSize": 64,
            "targetFrameMilliseconds": 16.67,
            "deadlineMilliseconds": 0.0,
            "estimatedMillisecondsPerState": 0.09782,
            "expectedUseProbability": 1.0,
            "hotSetTier": 1,
            "bootstrapBatchSize": 1,
            "budgetSafetyMarginMilliseconds": 2.0,
            "budgetCostSafetyMultiplier": 1.5,
            "budgetCooldownFrames": 8,
            "preinteractiveBootstrap": true
        },
        {
            "phase": "u3",
            "collectionFile": "unit-3.graphicsstate",
            "collectionSha256": "affc773f52fb57f10b7f5e20ab8066ff26ab61ba774fcd7a4baf40ed182c09ce",
            "variantCount": 0,
            "graphicsStateCount": 5,
            "required": false,
            "prewarmAtStartup": true,
            "traceCacheMisses": true,
            "priority": 0,
            "initialBatchSize": 8,
            "minimumBatchSize": 1,
            "maximumBatchSize": 64,
            "targetFrameMilliseconds": 16.67,
            "deadlineMilliseconds": 0.0,
            "estimatedMillisecondsPerState": 0.10428,
            "expectedUseProbability": 1.0,
            "hotSetTier": 1,
            "bootstrapBatchSize": 1,
            "budgetSafetyMarginMilliseconds": 2.0,
            "budgetCostSafetyMultiplier": 1.5,
            "budgetCooldownFrames": 8,
            "preinteractiveBootstrap": true
        }
    ],
    "planSha256": "d94631a84acf4710226913fc9bffbf5f7c24d44a1b53a1a8cd139b1ec2d81b7b"
}